{
  "schema": 1,
  "type": "EAM_LIVE_VALIDATION_MATRIX",
  "matrixVersion": "2026-08-14.1",
  "product": "wow_retail",
  "operationPolicy": {
    "humanInputOnly": true,
    "automatedGameplayInput": false,
    "automatedReloadUI": false,
    "offlinePassIsLivePass": false,
    "personalDataAllowed": false
  },
  "clients": {
    "_ptr_": {
      "channel": "PTR",
      "patch": "12.1.0",
      "interface": 120100
    },
    "_xptr_": {
      "channel": "XPTR",
      "patch": "12.0.7",
      "interface": 120007
    },
    "_retail_": {
      "channel": "RETAIL",
      "patch": "12.1.0",
      "interface": 120100
    }
  },
  "cases": [
    {
      "id": "live.environment.identity",
      "category": "environment",
      "required": true,
      "procedure": "確認玩家宣告的安裝目錄與 GetBuildInfo 觀測的 patch、build、Interface 及 test-build 屬性一致。"
    },
    {
      "id": "live.tooltip.spellbook",
      "category": "tooltip",
      "required": true,
      "procedure": "玩家手動停留技能書法術，確認 ID 列、Ctrl+Alt 選單與技能冷卻加入流程。"
    },
    {
      "id": "live.tooltip.actionbar_macro",
      "category": "tooltip",
      "required": true,
      "procedure": "玩家手動停留動作列巨集，確認可安全解析法術／物品，或明確降級為手動輸入。"
    },
    {
      "id": "live.tooltip.bag_item",
      "category": "tooltip",
      "required": true,
      "procedure": "玩家手動停留背包物品，確認物品 ID、Ctrl+Alt 選單與物品冷卻加入流程。"
    },
    {
      "id": "live.tooltip.player_aura",
      "category": "tooltip",
      "required": true,
      "procedure": "玩家手動停留自身光環；Retail／PTR 12.1 使用官方 Aura ID 顯示，XPTR 12.0.7 無能力時採已知 ID 手動輸入。"
    },
    {
      "id": "live.tooltip.target_aura",
      "category": "tooltip",
      "required": true,
      "procedure": "玩家手動停留目標光環；Retail／PTR 12.1 使用官方 Aura ID 顯示，XPTR 12.0.7 無能力時採已知 ID 手動輸入。"
    },
    {
      "id": "live.tooltip.out_of_combat",
      "category": "combat",
      "required": true,
      "procedure": "在非戰鬥狀態確認 Tooltip 與加入監控流程可用。"
    },
    {
      "id": "live.tooltip.in_combat_rejected",
      "category": "combat",
      "required": true,
      "procedure": "玩家自行進入戰鬥後確認 Ctrl+Alt 不開啟／不重播選單；脫戰後再記錄結果。"
    },
    {
      "id": "live.popup.escape_cancel",
      "category": "popup",
      "required": true,
      "procedure": "確認 ESC、取消與關閉不會寫入監控清單。"
    },
    {
      "id": "live.popup.commit_added_unchanged",
      "category": "popup",
      "required": true,
      "procedure": "確認第一次加入回報 added，重複加入回報 unchanged，且儲存位置符合來源類型。"
    },
    {
      "id": "live.tooltip.reload_resume",
      "category": "reload",
      "required": true,
      "procedure": "先建立 checkpoint，由玩家自行輸入 /reload，回來後確認 session、CVar 與 SavedVariables 行為。"
    },
    {
      "id": "live.blizzard_input_unchanged",
      "category": "input",
      "required": true,
      "procedure": "確認一般左鍵、右鍵與無修飾鍵操作仍維持 Blizzard 原始行為。"
    },
    {
      "id": "live.popup.combat_transition",
      "category": "combat",
      "required": true,
      "procedure": "先開啟 EAM 選單再由玩家進入戰鬥，確認選單安全關閉且不執行延後寫入。"
    },
    {
      "id": "live.tooltip.generation_switch",
      "category": "tooltip",
      "required": true,
      "procedure": "快速切換不同 Tooltip，確認只對最新來源開啟，沒有 stale candidate。"
    },
    {
      "id": "live.api.load_order",
      "category": "lifecycle",
      "required": true,
      "procedure": "確認 API 初始不可用或 Blizzard LoD 載入後不會重複註冊、重複加入或產生 Lua error。"
    },
    {
      "id": "live.errors.none_observed",
      "category": "safety",
      "required": true,
      "procedure": "整輪確認 Lua error、taint、blocked action、Forbidden access 均未觀察到。"
    },
    {
      "id": "live.layout.timer_anchor_size",
      "category": "layout",
      "required": true,
      "procedure": "確認倒數至少測試框內、框外、最小 8、預設 14、最大 32 字級，XPTR 12.0.7 與 Retail／PTR 12.1 行為一致。"
    },
    {
      "id": "live.layout.applications_anchor_size",
      "category": "layout",
      "required": true,
      "procedure": "確認 applications 至少測試框內八方向、框外八角位與四面，以及最小 8、預設 12、最大 32 字級。"
    },
    {
      "id": "live.aura.single_countdown",
      "category": "aura",
      "required": true,
      "procedure": "關閉雙倒數診斷後重建 Native Aura 容器；Retail／PTR 12.1 確認每個光環只顯示一套 EAM 可定位倒數，XPTR 12.0.7確認 Legacy 路徑也只有一套。"
    },
    {
      "id": "live.aura.dual_countdown_diagnostic",
      "category": "aura",
      "required": true,
      "procedure": "僅在測試面板啟用雙倒數診斷；Retail／PTR 12.1 由玩家觀察開始、中段、最後 3 秒兩套數字是否同步，完成後關閉。兩者共用同一 DurationObject，不視為獨立資料源；XPTR 12.0.7 確認此 Native 模式不可用且無 Native 呼叫。"
    },
    {
      "id": "live.cooldown.spell_countdown",
      "category": "cooldown",
      "required": true,
      "procedure": "玩家施放已監控且非 GCD 的技能，確認圖示、swipe 與倒數文字同時出現，充能技能消耗一層後也有回充倒數。"
    },
    {
      "id": "live.cooldown.item_trigger",
      "category": "cooldown",
      "required": true,
      "procedure": "玩家使用已監控背包物品，確認 BAG_UPDATE_COOLDOWN 或 12.1 SPELL_UPDATE_COOLDOWN 的 itemID 能觸發正確物品，且其他物品事件不誤觸。"
    },
    {
      "id": "live.ground.duration_auto",
      "category": "ground",
      "required": true,
      "procedure": "非戰鬥解析含明確秒數的技能說明，玩家施放後確認報告來源為 spellDescription 或 tooltipDescription，顯示時間符合靜態說明。"
    },
    {
      "id": "live.ground.duration_manual_fallback",
      "category": "ground",
      "required": true,
      "procedure": "選用無法解析秒數的地面技能並設定手動秒數，玩家施放後確認來源為 manualFallback、時間採手動值且報告含 groundDurationManualFallback。"
    },
    {
      "id": "live.visual.swipe_alpha",
      "category": "visual",
      "required": true,
      "procedure": "分別設定倒數轉圈透明度 0、0.5、1，確認一般冷卻、物品、地面效果與 Retail／PTR 12.1 Native Aura 在重建後皆符合設定。"
    },
    {
      "id": "live.aura.target_transition",
      "category": "aura",
      "required": true,
      "procedure": "Retail／PTR 12.1 對 target Aura 測試目標切換、戰鬥內外、單層到多層、有限時間到永久、同 Spell ID 不同施法者；記錄圖示存在但文字空白時屬哪一類，不讀回 FontString。"
    },
    {
      "id": "live.aura.native_border_capability",
      "category": "aura",
      "required": true,
      "procedure": "Retail／PTR 12.1 確認 capability 報告是否偵測 AddDispelTypeTexture；只判定官方驅散／靜態 border 能力，不將它宣稱為 Pandemic、Proc 或任意條件 Glow 的替代品。XPTR 12.0.7 應回報不可用。"
    },
    {
      "id": "live.aura.native_pandemic_region",
      "category": "aura",
      "required": true,
      "procedure": "Retail／PTR 12.1 啟用單一 Pandemic Region，觀察官方 Pandemic Window 顯示與消失，確認 EAM 不讀 SecretAspect.Shown、不建立自己的 OnUpdate；XPTR 12.0.7 應降級且不呼叫 native API。"
    },
    {
      "id": "live.aura.native_dispel_options",
      "category": "aura",
      "required": true,
      "procedure": "Retail／PTR 12.1 觀察 showAlways、Harmful／Helpful 與 Stealable／NotStealable option；確認 showAlways 不再同時輸出無作用的 stealableFilter，且不使用舊 AuraBorder alias。"
    },
    {
      "id": "live.aura.container_disable_clear",
      "category": "aura",
      "required": true,
      "procedure": "Retail／PTR 12.1 停用 AuraContainer 後確認 AuraButton 與 ItemEnchantment 顯示資料清除但框架仍存在，重新啟用後不重複建立或產生 Lua error。"
    },
    {
      "id": "live.unitpower.secondary_numeric",
      "category": "unitpower",
      "required": true,
      "procedure": "由玩家切換可產生次要資源的專精並手動產生、消耗、歸零；確認 EAM 選中 HolyPower／ComboPoints／SoulShards／Chi／ArcaneCharges 等次要資源，數值 1 仍顯示。"
    },
    {
      "id": "live.unitpower.primary_native_sink",
      "category": "unitpower",
      "required": true,
      "procedure": "從測試面板啟動 UnitPower 能力探針，由玩家產生／消耗主要資源；Retail／PTR 12.1 觀察 StatusBar 與 radial sink，XPTR 12.0.7 觀察 StatusBar fallback，標記結果並回傳 EAM_UNIT_POWER_CAPABILITY_REPORT。"
    },
    {
      "id": "live.unitpower.combat_deferred",
      "category": "unitpower",
      "required": true,
      "procedure": "Retail／PTR 12.1 與 XPTR 12.0.7 進入戰鬥後觀察資源變化，確認安全 NUMERIC 資源與 Secret resource sink 仍依事件更新；不得以 Lua 讀回或匯出 Secret raw 值，也不得在戰鬥中做結構性重建。脫戰後只驗證 pending 結構變更由事件合併一次，報告保留 combatDeferred 邊界。"
    },
    {
      "id": "live.aura.duration_zero_regression",
      "category": "aura",
      "required": true,
      "procedure": "Retail／PTR 12.1 測試永久、零或瞬間結束 Aura，確認 PTR8 修正不再把有效 duration text 錯顯示為 0，無安全 duration 時仍只顯示官方允許的狀態。"
    },
    {
      "id": "live.aura.sound_added",
      "category": "aura",
      "required": true,
      "procedure": "Retail／PTR 12.1：在光環細部設定選擇可辨識素材，只勾「光環新增」，並確認全域音效已啟用；玩家手動取得該 player／target Aura，應只播放一次。XPTR 12.0.7 應停用控制項、保留設定且不得呼叫 AddAuraSound。"
    },
    {
      "id": "live.aura.sound_applications_increased",
      "category": "aura",
      "required": true,
      "procedure": "Retail／PTR 12.1：只勾「層數增加」，先取得可堆疊 Aura，再由玩家逐層增加；每次增加應各播放一次，初次新增與移除不得誤播。XPTR 12.0.7 應維持 capability 降級。"
    },
    {
      "id": "live.aura.sound_removed",
      "category": "aura",
      "required": true,
      "procedure": "Retail／PTR 12.1：只勾「光環移除」，由玩家讓 Aura 自然到期、驅散或實際移除；每次真實移除應播放一次，停用容器、改設定與 /reload 不得冒充 Aura 移除。XPTR 12.0.7 應維持 capability 降級。"
    }
  ]
}
